[
  {
    "id": "gen_z_micro_freelance_marketplace",
    "vertical": "gen_z",
    "version": "1.0.0",
    "hook": "A micro-freelance marketplace where Gen-Z sells 15-min skills (resume edits, design feedback) for $5-25.",
    "core_problem": "70M Gen-Z workers want hyperflexible income; Fiverr is too transactional; Upwork is for projects.",
    "emotional_driver": "autonomy",
    "ai_leverage": "Quality agent verifies skill samples; matching agent connects buyers per turnaround + budget; payment agent settles instantly.",
    "business_model": "marketplace",
    "monetization_logic": "15% take rate; instant payout via card.",
    "distribution_strategy": "Creator + TikTok community channels.",
    "retention_loop": "Per-freelancer reputation + buyer corpus lock.",
    "moat_potential": { "class": "network", "rationale": "Two-sided micro-skill network compounds." },
    "scalability_score": 7,
    "scalability_rationale": "Software + community channel scales fast.",
    "billion_dollar_path": "Stage 1: micro-skills. Stage 2: full Gen-Z work platform. Stage 3: bundled with finance + tax + insurance.",
    "failure_avoidance": [
      "regulatory_blind_spot: state worker classification + 1099",
      "unsustainable_unit_economics: take rate + instant payout fee"
    ],
    "validation_principle": "medici",
    "validation_invocation": "Indispensable infrastructure for Gen-Z micro-work.",
    "technical_mvp_sketch": {
      "stack": "Next.js + Python + Postgres + Stripe Connect",
      "agents": ["hermes:quality_verifier", "openclaw:matching_dag", "hermes:payout_processor"],
      "data": "Per-freelancer reputation, buyer history.",
      "infra": "AWS + RDS; per-state worker compliance.",
      "hitl": "Trust + safety reviews disputes; ops verifies new freelancers."
    },
    "ui_ux_operating_model": "voice_first",
    "ui_ux_invocation": "Buyer says 'I need a TikTok hook in 30 min for $15'; agent finds + delivers."
  },
  {
    "id": "gen_z_career_skill_bootcamp_ondemand",
    "vertical": "gen_z",
    "version": "1.0.0",
    "hook": "An on-demand skill bootcamp that pays you back if you land the job in 12 months.",
    "core_problem": "30M Gen-Z workers need skills upgrade; existing bootcamps cost $10-20k upfront; outcomes mixed.",
    "emotional_driver": "mastery",
    "ai_leverage": "Curriculum agent personalizes; coaching agent runs daily check-ins; placement agent connects to employers.",
    "business_model": "outcome_based",
    "monetization_logic": "Income share agreement: 8% of salary for 24 months on jobs >$50k.",
    "distribution_strategy": "Creator + TikTok community + employer partnerships.",
    "retention_loop": "Per-student progress + employer placement compounds.",
    "moat_potential": { "class": "data", "rationale": "Per-student outcome corpus + employer network compounds." },
    "scalability_score": 7,
    "scalability_rationale": "Software + community + employer partnerships.",
    "billion_dollar_path": "Stage 1: tech bootcamps. Stage 2: full skill + career OS. Stage 3: bundled with finance + insurance.",
    "failure_avoidance": [
      "regulatory_blind_spot: ISA + state education + CFPB consumer credit",
      "unsustainable_unit_economics: ISA aligns ARR to outcomes"
    ],
    "validation_principle": "buffett",
    "validation_invocation": "Defensible outcome-based moat + employer trust.",
    "technical_mvp_sketch": {
      "stack": "Next.js + Python + Postgres + LMS + employer API",
      "agents": ["hermes:curriculum_modeler", "openclaw:placement_dag", "hermes:coach"],
      "data": "Per-student progress, employer outcomes, salary corpus.",
      "infra": "AWS + Snowflake; per-state ed compliance.",
      "hitl": "Coach reviews student progress weekly; ops verifies employer outcomes."
    },
    "ui_ux_operating_model": "voice_first",
    "ui_ux_invocation": "Student does daily voice check-in; agent adapts curriculum + coaches."
  },
  {
    "id": "gen_z_dating_safety_first",
    "vertical": "gen_z",
    "version": "1.0.0",
    "hook": "A dating app safety layer that verifies identity + reduces ghosting + builds reputation.",
    "core_problem": "40M Gen-Z users on dating apps face safety + bad-faith issues; existing apps (Tinder, Hinge) lack reputation.",
    "emotional_driver": "fear",
    "ai_leverage": "Identity-verification agent runs ID + bio checks; reputation agent maintains per-user trust score; intervention agent flags red-flag patterns.",
    "business_model": "subscription",
    "monetization_logic": "$15/mo + premium safety bundle.",
    "distribution_strategy": "PLG via 'verify your match' wedge + community channels.",
    "retention_loop": "Per-user trust + match corpus lock.",
    "moat_potential": { "class": "data", "rationale": "Per-user reputation + outcome corpus is unique." },
    "scalability_score": 7,
    "scalability_rationale": "Software + community channel scales fast.",
    "billion_dollar_path": "Stage 1: safety overlay. Stage 2: full Gen-Z relationship + safety platform. Stage 3: bundled with insurance + concierge.",
    "failure_avoidance": [
      "regulatory_blind_spot: BIPA + state biometric + CCPA + GDPR",
      "fake_ai_trap: trained reviewers verify any flagged user"
    ],
    "validation_principle": "buffett",
    "validation_invocation": "Defensible safety brand + reputation moat.",
    "technical_mvp_sketch": {
      "stack": "React Native + Python + Postgres + Persona ID",
      "agents": ["hermes:identity_verifier", "openclaw:reputation_dag", "hermes:safety_intervention"],
      "data": "Per-user verification, reputation, intervention outcomes.",
      "infra": "AWS + RDS; per-state biometric.",
      "hitl": "Trust + safety reviews any flagged escalation."
    },
    "ui_ux_operating_model": "invisible",
    "ui_ux_invocation": "User toggles safety; verifications + reputation run in background."
  },
  {
    "id": "gen_z_apartment_finder_with_roommate_matching",
    "vertical": "gen_z",
    "version": "1.0.0",
    "hook": "An apartment finder that matches you with a roommate and a place — and signs the lease in one flow.",
    "core_problem": "20M Gen-Z renters relocate annually; finding apartment + roommate + lease is fragmented.",
    "emotional_driver": "convenience",
    "ai_leverage": "Lifestyle-matching agent picks roommates; listing agent surfaces apartments; lease agent handles co-signing.",
    "business_model": "transaction_fee",
    "monetization_logic": "$199 finder fee + landlord referral revenue.",
    "distribution_strategy": "Apartment-listing partnerships + community channels.",
    "retention_loop": "Per-user + per-roommate history compounds for next move.",
    "moat_potential": { "class": "network", "rationale": "Two-sided roommate + apartment network compounds." },
    "scalability_score": 7,
    "scalability_rationale": "Per-metro cold-start; software margins after.",
    "billion_dollar_path": "Stage 1: apartment + roommate. Stage 2: full Gen-Z relocation + lease OS. Stage 3: bundled with renters insurance + utilities.",
    "failure_avoidance": [
      "regulatory_blind_spot: Fair Housing Act + state landlord-tenant",
      "unsustainable_unit_economics: finder + referral keep margin healthy"
    ],
    "validation_principle": "medici",
    "validation_invocation": "Indispensable infrastructure for Gen-Z renters + landlords.",
    "technical_mvp_sketch": {
      "stack": "Next.js + Python + Postgres + apartment APIs + DocuSign",
      "agents": ["hermes:lifestyle_matcher", "openclaw:listing_dag", "hermes:lease_router"],
      "data": "Per-user lifestyle, apartment listings, lease outcomes.",
      "infra": "AWS + RDS; Fair Housing + per-state.",
      "hitl": "Compliance reviews any flagged listing; user signs lease."
    },
    "ui_ux_operating_model": "agent_mediated",
    "ui_ux_invocation": "User answers lifestyle quiz; agent surfaces 3 roommate + apartment combos."
  },
  {
    "id": "gen_z_paycheck_to_savings_autopilot",
    "vertical": "gen_z",
    "version": "1.0.0",
    "hook": "A paycheck-to-savings autopilot that builds Gen-Z's first $5k cushion without budget guilt.",
    "core_problem": "60% of Gen-Z lives paycheck to paycheck; existing apps (Acorns, Qapital) require manual setup.",
    "emotional_driver": "fear",
    "ai_leverage": "Income + spend agent baselines; savings agent skims optimal % per paycheck; emergency-buffer agent rebalances.",
    "business_model": "subscription",
    "monetization_logic": "$5/mo + interchange revenue.",
    "distribution_strategy": "Creator + community + employer benefits channels.",
    "retention_loop": "Per-user balance + history lock.",
    "moat_potential": { "class": "switching_cost", "rationale": "Per-user balance + savings history account-locked." },
    "scalability_score": 8,
    "scalability_rationale": "B2C + employer benefits scale fast.",
    "billion_dollar_path": "Stage 1: D2C. Stage 2: full Gen-Z financial OS. Stage 3: bundled with credit + insurance.",
    "failure_avoidance": [
      "regulatory_blind_spot: state finance + minor banking + ECOA",
      "unsustainable_unit_economics: subscription + interchange"
    ],
    "validation_principle": "buffett",
    "validation_invocation": "Defensible Gen-Z trust brand + interchange.",
    "technical_mvp_sketch": {
      "stack": "React Native + Node + Postgres + Plaid + Galileo",
      "agents": ["hermes:income_baseliner", "openclaw:savings_dag", "hermes:rebalancer"],
      "data": "Per-user income + spend + savings.",
      "infra": "AWS + RDS; PCI + per-state finance.",
      "hitl": "User approves any large transfer; advisor reviews any policy."
    },
    "ui_ux_operating_model": "invisible",
    "ui_ux_invocation": "User connects payroll; savings happen silently."
  },
  {
    "id": "gen_z_mental_health_chat_first",
    "vertical": "gen_z",
    "version": "1.0.0",
    "hook": "A chat-first mental-health surface that meets Gen-Z where they already vent.",